{
  "schema_version": 1,
  "observation_id": "obs-example-0001",
  "concept_id": "chain_rule",
  "task_id": "transfer-003",
  "task_type": "transfer",
  "outcome": "partial",
  "assistance": {
    "requested": true,
    "levels_revealed": ["H1", "H2"],
    "scaffold_types": ["method_prompt"],
    "partial_transformation_shown": false,
    "full_solution_viewed": false
  },
  "error_tags": ["conceptual_error"],
  "diagnostic_confidence": "high",
  "learner_self_confidence": "medium",
  "learner_explanation": "Я выбрал композицию, но не записал внутреннюю производную.",
  "source_refs": ["official-exam-list:q5"]
}

